"Everyone that grew up during the early years of this millennium knows BlackBerry. Often credited with being the world's first maker of the mainstream smartphone, BlackBerry has seen many a heyday, once holding over 20 percent of the global smartphone market and shipping more than 50 million devices every year. However, the iconic Canadian company missed the turn in the millennium that saw the rest of the world run helter skelter towards Android and the dawn of touchscreen smartphones inspired by the equally iconic Steve Jobs. After ceasing to operate its own brand of smartphones in 2016 and licensing its brand to TCL Electronics, BlackBerry has announced on Twitter today that it is severing its partnership from TCL. With no news of a change of hands in partnership, this may well be the end of the way for BlackBerry, once a behemoth in the world of mobile devices. The company has been in the dead, for all intents and purposes. Its last smartphone, the BlackBerry Key2 LE, was unveiled nearly two years ago. In comparison to the fanfare and near frantic hubbub that brands such as Xiaomi, Samsung, Oppo and other leading smartphone players generate, the Key2 LE came — and went — in comparative silence, perhaps speaking a lot about the recent state of the brand. As a result, the announcement from BlackBerry does not come as a surprise. What does strike out, though, is that BlackBerry is not drawing a complete end to its future trysts with smartphones. The company's statement on Twitter says that only its partnership with TCL has ended, suggesting that it remains open to the prospect of a new manufacturing partner, or a comeback in one way or another, in the coming years. That said, it seems unlikely that BlackBerry smartphones will ever be a thing again. While the ever shifting nature of technology means one can never say never, it seems unlikely that the brand will ever scale the heights it once did in the world of mobile devices. BlackBerry Limited will continue operating as it has, and given today's cybersecurity climate and the company's expertise with enterprise security, may see it being in and around the smartphone industry via software only. As for its devices in the market today, BlackBerry has announced that its partner TCL will honour warranties and service requests in respective markets. No word, however, has been said about software updates going forward. Is this the end of BlackBerry's round two, then? Going by information available right now, it certainly feels so.","After ceasing to operate its own brand of smartphones in 2016 and licensing its brand to TCL Electronics, BlackBerry has announced on Twitter today that it is severing its partnership from TCL."
"It appears BlackBerry phones may become a thing of the past. The reason for this is TCL Communications, the company that has the contract to manufacture and sell the BlackBerry phones says the contract is valid only till August 31, 2020. The company will stop selling BlackBerry branded phones post this date though it says it will support the devices sold till that date. TCL has been holding this licence covering practically the entire world. There are very few pockets where other companies hold the rights, but they are really not up to much in terms of making and selling the phone. The licence allowed TCL to design and manufacture the phones and sell under the BlackBerry brand. This ensured the brand stayed alive in the marketplace and kept the brand name in the minds and hearts of the user community. That may not happen now, unless between now and August, BlackBerry finds another manufacturer willing to take on the task from TCL. It has been reported that TCL has developed its own brand and will focus on that after it stops making and selling the Blackberry devices. Experts say TCL had done a decent job of making Android-run smartphones with attractive designs and trying to keep the original Blackberry flavour alive. None of these phones may have turned out to be runaway successes as a model in the highly competitive field, but they were not abject failures either. Indonesia India, Sri Lanka, Nepal, and Bangladesh are the markets excluded from the contract TCL had for the BlackBerry brand.","The reason for this is TCL Communications, the company that has the contract to manufacture and sell the BlackBerry phones says the contract is valid only till August 31, 2020. The company will stop selling BlackBerry branded phones post this date though it says it will support the devices sold till that date. "
"India’s unity in diversity was yet again on display at Shaheen Bagh on Thursday as different religion and faith groups came together to organise an inter-faith prayer ceremony called “Jashn-e-ekta”. Cutting across religious lines, they, along with the anti-Citizenship Amendment Act protesters, offered prayers for peace in the country. The first such event by anti-CAA protesters was held on January 12. Hawan, kirtan and prayers of different religions marked the second edition of “Jashn-e-ekta”. While hawan and kirtan marked the beginning of the prayer, several protesters were seen holding the Bible, holy books from different religions and posters of unity on the occasion. Religious chants reverberated in the air. “The government has been saying that we (Muslims) are the only ones who are protesting against the CAA and NRC. These inter-faith prayers prove that people from all communities are against these,” said a protester at Shaheen Bagh. Meanwhile, around 450 farmers from Punjab have also joined the protest in solidarity with Shaheen Bagh protesters. They will be staying there till February 8. Several artistes have also been performing at the protest site. Slaves of Freedom was expected to perform post-midnight on Thursday. ","While hawan and kirtan marked the beginning of the prayer, several protesters were seen holding the Bible, holy books from different religions and posters of unity on the occasion. They will be staying there till February 8."
"The Delhi Police told a court here on Thursday that Kapil Baisala, arrested for firing in the air in Shaheen Bagh during an anti-CAA protest, was associated with a political party and the agency needed to interrogate him to ascertain if the alleged incident was part of any ""political conspiracy"". The probe agency further told the court Baisala did not do it in a rush of blood and it was a ""well-thought-out"" incident. The submissions were made before chief metropolitan magistrate Gurmohina Kaur who extended by two days the police custody of Baisala. ""I am of the opinion, two days further remand of accused Kapil Baisala, is necessary at this stage for proper investigation of present case in order to identify supplier of alleged pistol and for purpose of further investigation of the case,"" the judge said. Police had said on February 4 that Baisala was a member of the Aam Aadmi Party and he and his father had joined the AAP in early 2019. Additional commissioner of police Manoj Pant sought three days remand for custodial interrogation of Baisala on the ground that the accused was misleading the probe agency in locating the arms dealer and his laptop which has crucial evidence. ""He did not do it in a rush of blood. It was a well-thought-out incident. He raised slogans of ""Jai Shri Ram"" and ""Hamare desh me aur kisi ki nahi chalegi, sirf Hinduon ki chalegi (only Hindus shall have a say in our country, no one else) to mislead everyone. He fired two rounds in the air. He had purchased 13 cartridges in total. He is also not giving us the location of the other cartridges,"" the police said. The police said Baisala belonged to a family which has a political history. ""Accused has revealed his association with a political party and investigation of any possible conspiracy in alleged incident required to be probed. Time and place of the incident clearly indicate use of firearms at that particular place (Shaheen Bagh) seems to be a part of a larger conspiracy. ""During investigation, it has emerged that accused has political ambitions and active in politics. He belongs to a family which has a political history. Accused is to be further interrogated as to whether incident is part of any political conspiracy. Whole conspiracy behind this is to be unearthed,"" the agency said in its reply submitted before the court. It further said Baisala's father and brother have also been issued notices twice by the police for interrogation but they failed to come. ""He is not giving the complete address of one Sachin Tiwari, who allegedly supplied arms to him. Tiwari is a resident of Bihar and he needs to be taken to Patna to locate and identify the arms dealer. He is misleading the probe agency. ""His father and brother have not joined the investigation and deliberately avoiding it. Their phones are switched off too. We need to interrogate his friends too... Accused has to be taken to his relatives residing in Greater Noida, Meerut in search of them and thereafter they will be subjected to joint interrogation with the accused,"" the police said. It said further custody was required to confront Baisala with several chats, conversations, call records found in his phone. ""Data stored in the phone is voluminous and complete scrutiny will take more time,"" it said. Pant added that the accused was not giving the agency the passwords of his phone, his Facebook, Twitter, Instagram and TikTok accounts. When the judge asked Baisala where the rest of the cartridges were, he claimed he used them in marriages before. ""I have given them the password. My phone was open. The police locked the Facebook account,"" he said. The police said the accused was associated with different groups on WhatsApp. whose members were being identified at his instance. ""Some have been interrogated. Others need to join the investigation. They need to be interrogated at his presence... Call data records of Baisala's mobile phone is being scrutinised and he need to be confronted with it. ""He also need to be confronted with frequent callers and other suspects being identified and examined. Some mobile numbers are switched off and some are also not available at their residence,"" it said. Advocate Akhil Rexwal, appearing for Baisala, vehemently opposed the police remand and said the accused has given all information to the police, including the mobile numbers of his father and brother. ""If they can't locate him. it is not his fault. He is ready to cooperate with the police and join the investigation as and when called. He will give his laptop and all other materials required. ""This is a not a political issue. He himself had given to the police the form he filled when he joined AAP. He had joined AAP long back. The police is harassing him,"" the lawyer said. The police had earlier told the court that investigation has revealed that his WhatsApp account was purposely deleted. On February 1, Baisala had fired two rounds in the air in Shaheen Bagh, where an protest against the Citizenship Amendment Act (CAA) is being held for over a month now.","The Delhi Police told a court here on Thursday that Kapil Baisala, arrested for firing in the air in Shaheen Bagh during an anti-CAA protest, was associated with a political party and the agency needed to interrogate him to ascertain if the alleged incident was part of any ""political conspiracy"""
"Union home minister Amit Shah on Thursday alleged that the anti-CAA protest at Shaheen Bagh was a ""joint venture"" between the AAP and the Congress, and asserted that the ""tukde-tukde gang"" would get a ""shock"" when the Delhi election results will be declared. The former BJP president, who held as many as three roadshows in different parts of the national capital on the last day of the campaign for the high-stakes Delhi assembly elections, said his party would emerge victorious in the elections as people will vote for country's security, development and good governance. Complete coverage on Delhi elections The controversial slogan of 'goli maro' was again raised during Shah's roadshow in West Delhi's Hari Nagar constituency where he was campaigning for party candidate Tajinder Pal Singh Bagga. However, police stopped those who raised the slogan. ""Shaheen Bagh is the joint venture between the Aam Aadmi Party and the Congress,"" he alleged, adding that Delhi Chief Minister Arvind Kejriwal and Congress leader Rahul Gandhi were worried that Shaheen Bagh is being discussed. ""I want to ask them why the security of the country should not be an electoral issue? Why are the people sitting in Shaheen Bagh demanding 'Jinnah Wali Azadi' and why the tukde-tukde gang is supporting them? Shame on these people,"" he said at a roadshow in Seemapuri constituency in northeast Delhi. Asking people to vote for the BJP, he said, ""I want to tell all of you that tukde-tukde gang is going to get a shock because you are going to press the button on lotus symbol on February 8 for development of Delhi and the country."" Addressing the public in Bagga's constituency, Shah talked about the Pulwama terror attack and said Indian forces took revenge by conducting an airstrike. ""You all know that the people of Delhi, as well as the whole nation, was saluting the valour of the army, but do you know who was most unhappy? First Rahul Gandhi, second Arvind Kejriwal and third was Imran Khan sitting in Pakistan"". Shah said Kejriwal, Gandhi and Khan had a problem with the surgical strike. ""All three had a problem with the surgical strike. I want to ask whether such people should be handed over the power in Delhi? These people are very dangerous for the security of the nation. ""On the other hand, the central government is constantly working for the public interest, providing housing, gas connections and basic facilities to the people,"" he said. Alleging that the Kejriwal-led government has failed to deliver on its promises, Shah claimed that no work has been done in the last five years. ""Kejriwal has not done any work in the last five years. He had promised that 500 schools and 50 colleges will be opened, five thousand new buses will be added to the fleet. He even claimed that he will make Delhi a city like London. ""Today it is difficult to differentiate whether there are potholes on the roads of Delhi or there is a road in the potholes. On the contrary, they did not allow people of Delhi to take benefit of the schemes of the Central Government,"" he said, claiming that Kejriwal did not allow Ayushman scheme to be implemented in Delhi.","Union home minister Amit Shah on Thursday alleged that the anti-CAA protest at Shaheen Bagh was a ""joint venture"" between the AAP and the Congress, and asserted that the ""tukde-tukde gang"" would get a ""shock"" when the Delhi election results will be declared."
"Exuding confidence on forming the next government in Delhi, Union home minister Amit Shah on Thursday claimed that BJP will win more than 45 seats in the national capital. Complete Coverage on Delhi Elections ""Got a chance to interact with the people of Delhi during the elections. Delhi is tired of false promises, appeasement, and anarchy, it now wants development. Seeing the support for BJP in Delhi makes it clear that on February 11 BJP will form the government by winning more than 45 seats in Delhi,"" Shah tweeted on the last day of campaigning for the Delhi assembly elections. In his earlier tweets, Shah shared photos and videos from his roadshows in Madipur and Seemapuri assembly constituencies held on Thursday. In one of these tweets, Shah said that the large turnout of people at BJP's rallies was a sign of the party's popularity in Delhi. Shah was accompanied by LJP chief Chirag Paswan and Delhi BJP president Manoj Tiwari at the roadshow in Seemapuri. BJP is holding a 'Janasampark Abhiyan' across the city in a bid to reach out to every household and request them to vote for it in the upcoming election. As the campaigning for Delhi assembly elections comes to an end at 6pm on Thursday, Shah is expected to hold two more roadshows in Hari Nagar assembly constituency. Deputy chief minister and AAP leader Manish Sisodia is also holding a 'padyatra' in his Patparganj assembly constituency. The voting for all 70 assembly constituencies in Delhi is scheduled for February 8 and the counting of votes will take place on February 11.","Exuding confidence on forming the next government in Delhi, Union home minister Amit Shah on Thursday claimed that BJP will win more than 45 seats in the national capital."
"Around 40,000 Delhi Police personnel, 190 coys (companies) of Central Armed Police Forces (CAPFs) and 19,000 Home Guards have been deployed for smooth conduct of election in the national capital, officials said on Thursday. While the Delhi Police personnel have been put on specific election duties, the coys of CAPFs will ensure the security of polling premises and movement of EVMs. In addition, 19,000 Home guards will assist local police in ensuring security for polling booths, the officials said. Complete coverage on Delhi elections Marked by the BJP aggressively pushing the anti-CAA protests in Shaheen Bagh as a poll issue, the AAP hard selling development and the Congress conspicuous by its near absence, the bitter, often divisive campaign for the Delhi assembly elections ended on Thursday, ahead of the voting on Saturday. A multi-layered security has been provided to 21 counting centres and 2,689 polling premises, out of which 545 are ""critical"", a senior police official said. Additional forces have also been deployed to bolster the security of EVMs, critical booths and counting centres, he said. Static surveillance teams and flying squads have been deployed and special checking drives are being conducted in vulnerable areas to check any attempt to influence by money or muscle power and other unlawful practices, according to police. ""EVM transportation drill has been planned in coordination with polling officials. All necessary measures have also been taken from the anti-terror angle in vulnerable areas. Senior officers will closely supervise arrangements at the ground level. ""Thorough area domination will be ensured in sensitive and vulnerable areas, and all precautions will be taken to ensure smooth movement of voters to the booths,"" said Anil Mittal, additional PRO (Delhi Police). Pickets on borders have been strengthened to check transportation of illicit liquor and other contraband. All border areas will be kept under strict vigil by regular coordination with counterparts of NCR police, he said. Also, patrolling on boats in the Yamuna river is being done, he added. According to police, since the enforcement of Model Code of Conduct, 96,798.8 litres of illicit liquor and 774.1 Kg drugs have already been seized as part of special drives. So far, 494 illegal fire-arms and 706 ammunition have been recovered. Besides, 7,397 licensed weapons have also been deposited as a preventive measure, police said. Police have also issued a public appeal to report and share objectionable messages and other social media messages which violate Model Code of Conduct and Elections Commission's directions, with Nodal Officer on 8130099105, acp-cybercell-dl@nic.in or 011-28031130 (Fax).","Around 40,000 Delhi Police personnel, 190 coys of Central Armed Police Forces and 19,000 Home Guards have been deployed for smooth conduct of election in the national capital, officials said on Thursday. "
"More than 130 centenarian voters are eligible to exercise their franchise in the February 8 election and they will be treated ""as a VIP"" on the polling day, officials said on Thursday. Earlier, the Delhi Chief Electoral Officer (CEO) office had identified 150 centenarian voters but the number was revised after physical verification. Complete coverage on Delhi elections ""A total of 150 voters, aged 100 and above were initially identified by our officials. Later, physical verification was done but many of the centenarian voters were found to be dead, and some of them had shifted out of Delhi, so the final figure was revised,"" a senior official of the Delhi CEO office told PTI. After physical verification, the number of centenarian voters was revised to 132 -- 68 men and 64 women. The highest number of centenarians, 21, was found in West Delhi district and the lowest, 7, in New Delhi district, the official said. Kalitara Mandal, 110, a resident of CR Park in South Delhi's Greater Kailash constituency, is the oldest voter in Delhi. Bachchan Singh, 111, the oldest voter in the 2019 elections in the city who used to reside in Tilak Nagar, died last December. Delhi CEO Ranbir Singh on Wednesday said members of Bharat Scouts and Guides assisted the poll officials in physical verification process and ""documenting their stories"". During physical verification, officials check if such voters are alive or still living in Delhi. ""Of the 18 centenarians who were not found at home, most of them had died and some of them had shifted base from Delhi,"" the senior official said. Singh said these voters will be extended of all the facilities they had enjoyed in the 2019 Lok Sabha elections. ""A senior officer will go to the houses of each of these centenarian voters, residing nearest to the polling station in a constituency, and escort them to the booths. They will also motivate them to vote unless they are bedridden and their health doesn't permit,"" the CEO said. ""But if such voters are still eager to vote despite their frailty, we will make all possible arrangements to ensure they exercise their franchise. They will also be given priority in voting, so they don't have to stand in line,"" he said. At polling stations, they will be greeted with bouquets and election staff would take selfies with them, he said. ""Our staffers are going to each of these centenarians to physically check them, and on polling day, they will get pick-and-drop facility to the polling station,"" he said. Elections in Delhi are due on February 8 and the Delhi CEO office is making all arrangements to facilitate elderly citizens and voters with disability. ""Special arrangements would be made for Delhi voters who are aged 100 and above. They will be made to feel like 'VVIPs',"" Singh said. In the 2019 general elections, the Delhi CEO office had identified 96 centenarian voters in the city, and women had outnumbered men in that category. According to data shared by the Delhi CEO office, there were 42 male centenarian voters and 54 females in that category during last year's polls. ""We have been trying for the last four months to identify all voters who are aged 100 or above. This is the first such initiative to cater to such elderly voters who were born before Independence and saw the first general elections in 1952. For us, they are VVIP voters and they will be treated as such,"" Singh had said last year ahead of the 2019 polls.","More than 130 centenarian voters are eligible to exercise their franchise in the February 8 election and they will be treated ""as a VIP"" on the polling day, officials said on Thursday. During physical verification, officials check if such voters are alive or still living in Delhi."
"China has expanded its lockdown on more cities, restricting movement to an unprecedented 56 million people as it rushes to build a prefabricated, 1,000-bed hospital for victims, while the death toll from the outbreak continues to rise, casting a pall over Lunar New Year, the country's biggest and most festive holiday. The number of confirmed cases of coronavirus across China climbed sharply to more than 1,287, with at least 41 deaths reported as of Saturday morning. At least five cases are also reported in Hong Kong, two in Macau, and three cases in Taiwan. Worldwide, there are a total of 1,321 confirmed coronavirus infections, according to Al Jazeera's count, with cases also reported in Japan (2), Thailand (5), South Korea (2), United States (2), Australia (1), France (3) Malaysia (3), Singapore (3), Nepal (1), and Vietnam (2). As the death toll continues to rise, the National Health Commission announced on Saturday nationwide measures to identify suspected cases of the deadly virus on trains, aeroplanes and buses. Inspection stations will be set up and passengers with suspected pneumonia must be ""immediately transported"" to a medical centre, the statement said. In the southern city of Haikou, the city government also announced that that it will start a 14-day centralised medical observation for all tourists coming from Hubei province, the epicentre of the virus. Tourists from Hubei, especially from Wuhan city, are not allowed to leave the hotel where the medical observation will be held during the 14-day period, the announcement said. At least 450 military additional medical staff were deployed to Hubei to help with the treatment.","China expands its lockdown and restricts movement for 56 million people.The number of confirmed cases of coronavirus across China climbed sharply to more than 1,287, with at least 41 deaths reported. Worldwide, there are a total of 1,321 confirmed coronavirus infections. "
