"As the coronavirus spreads in Japan, and rapidly through the world, concerns have arisen about whether the Olympics, set to open on 24 July, can proceed at all and what fallback plans Japan has for postponement or cancellation.Officials in Japan and at the International Olympic Committee (IOC) have sought to reassure the public that the Games will go ahead as scheduled, despite the epidemic, but the Mainichi said there are event-specific plans for natural disasters that regularly strike the island nation.Under the plans, competitions would be cancelled if the venues were hit by a quake measuring an upper-6 or 7 on Japan’s intensity index, which runs to 7, the newspaper said, citing unidentified sources involved in the organising committee.Unlike a magnitude reading, which measures the inherent strength of a quake, intensity measures the amount of shaking felt at a given place.Japan often experiences earthquakes, but an upper-6 is one where it is impossible to stand, windows are likely to break and most unreinforced concrete-block walls collapse.In addition, the Mainichi said, the plans call for halting events if the authorities issue a 4 or higher on Japan’s 5-point disaster-warning system for a typhoon or other disaster.The Tokyo 2020 press office did not respond to a request for comment.A powerful typhoon forced the cancellation of three matches in last year’s Rugby World Cup.","As the coronavirus spreads, concerns have arisen about whether the Olympics can proceed at all and what fallback plans Japan has for postponement or cancellation.Officials in Japan and at the International Olympic Committee have sought to reassure the public that the Games will go ahead as scheduled, despite the epidemic"
"Ashish prevailed 5-0 in the largely lop-sided contest to set up a clash with Indonesia's Maikhel Roberrd Muskita. Muskita defeated New Zealand's Ryan Scaife in his pre-quarterfinal bout. Making the semi-finals would assure Ashish of his maiden spot in the Olympics scheduled in July-August this year.Up against a spunky rival, who he defeated in the Asian quarter-finals last year, Ashish played the waiting game to perfection, allowing Uulu to expend himself trying to connect.Uulu swung his arms more than the Indian but it was Ashish who connected more accurately in the opening three minutes.However, Uulu kept up the pressure in the second round as well and managed to land a couple of solid rights, which caught the Indian off-guard and led to scores being split.Ashish's powerful and precise right hand served him well in the final three minutes as judges ruled unanimously in his favour.On Wednesday, fast-rising women boxers Simranjit Kaur (60kg) and Sakshi Chaudhary (57kg) notched up hard-fought victories to enter the quarter-finals.World Championships bronze-medallist Simranjit defeated Kazakhstan's Rimma Volossenko 5-0, while former junior world champion Sakshi stunned Asian silver-medallist and fourth seed Nilawan Techasuep of Thailand in a split 4-1 verdict.",Asian silver-medallist Ashish Kumar (75kg) sailed into the quarter-finals of the continental Olympic Qualifiers for boxing with a thumping win over fourth-seeded.
"Hong Kong marathon which was scheduled for 9 February was called off on 25 January affecting 70,000 runners who had planned to participate. Other local marathons in Wuhan and Wuxi were also scrapped.The World Athletics Indoor Championships, which had been scheduled for Nanjing from 13 to 15 March, have been postponed until next year. World Athletics is working with organisers to settle on a date to host the biennial event in 2021.The Asian Athletics Association cancelled the 12 to 13 February indoor championships in Hangzhou.The Tokyo marathon's mass participation race, in which 38,000 had registered, has been cancelled. The race would only see the elite marathon runners taking part - 176 athletes and 30 wheelchair athletes. 1800 runners from China were registered to compete in Japan on 1 March. The race acts as an Olympic trial for Japanese marathon runners.Nagoya Women's Marathon, scheduled for 8 March, has been limited to elite runners only. The elite field features only the invited athletes and those who have run marathons in 3 hours or less. The public marathon and related events were expected to attract nearly 40,000 people.Pyongyang Marathon in North Korea on 12 April has been cancelled.A mixed relay Olympic triathlon qualification event scheduled to be held in the Chinese city of Chengdu in May was moved to Valencia in Spain, the International Triathlon Union (ITU) said.Three Asian Cup events, one in Taiwan and two in China, scheduled for March and April have also been postponed.The Paris half-marathon has been cancelled. The race involving some 44,000 competitors was scheduled for Sunday (1 March( in the French capital city. Organisers said the race will be postponed to a date yet to be determined.The Asian 20km Race Walk Championships in Japan scheduled for 15 March, where 13 Indians were to take part, has been cancelled. Tokyo Olympics-bound Bhawana Jat was to lead the Indian challenge in the event earlier scheduled for Nomi City. The Asian Athletics Athletics Association (AAA) took the decision to cancel the championship after a request from the Japan federation.","Coronavirus outbreak in China has resulted in numerous sporting events being moved or postponed At the time of writing, the death toll from the virus has crossed 3,200 and the number of cases has gone beyond 95,000"
"A major political row broke out on Monday over some videos clips showing purported thrashing of Jamia students in the university library by security personnel in December, with the BJP accusing the Congress of giving ""political colour"" to the incident and the Opposition party alleging that the government was ""misusing"" the police force as its ""muscle men"".The controversy was triggered by a 'video vs video' war with the Jamia Coordination Committee (JCC) releasing a CCTV footage of alleged ""police brutality"" in the old reading hall, only to be countered by a 'leaked' Delhi Police Crime Branch video which purportedly showed some ""rioters"" hiding in the library on 15 December. However, veracity of these videos could not be ascertained.""Congress party is continuously supporting antisocial elements and those who indulge in violence. It raises voice against the security forces and police personnel of the country,"" BJP spokesperson GVL Narasimha Rao said at a press conference.A 48-second video released by the JCC purportedly showed some seven to eight paramilitary and police personnel entering the Old Reading Hall and beating up students with batons. The paramilitary and police personnel are also seen covering their faces with handkerchiefs.Jamia videos spark political row: Congress backing anti-social elements, says GVL Narasimha Rao; BJP caught red-handed, alleges grand old partyFile image of policemen outside Jamia Millia Islamia University.In a second video, running around 5.25 minutes, people are purportedly seen entering the university's library in a rush. Some have their face covered.Rao asked why were students wearing masks and what were they studying with stones in their hands.""Which academic discipline requires students to wear masks and hold stones while studying?"" he asked.""The Congress party always choose to stand with those who are inimical to the country and rile up security forces,"" the BJP spokesperson added.Hitting out at the BJP, Congress spokesperson Jaiveer Shergill said the ruling party had been caught ""red-handed"".""They are guilty of misusing the police force as their muscle men. The BJP government is the accused and the culprit in the case of attack on innocent students. A court-monitored investigation is the need of the hour to probe this Jamia violence,"" he said.Congress leader Kapil Sibal also lashed out at the government for alleged ""police brutality"", saying when policemen hide the truth and there is no dialogue with the youth, democracy will slowly weaken at its roots.""Police brutality in Jamia library, 15 December (Tape). When policemen hide the truth. When there's no dialogue with the youth. When speeches are uncouth. When government becomes a sleuth. And data is full of 'jhooth' (lies). Slowly democracy will weaken at its roots,"" Sibal said in a tweet.The video released by the JCC, a group comprising Jamia Millia Islamia (JMI) students and alumni that was formed after the alleged police brutality on the campus on 15 December, was also shared on Twitter by Congress leader Priyanka Gandhi Vadra on Sunday.Priyanka Gandhi had said that if no action is taken even after the video, then the government's intentions will stand exposed.She had also accused Home Minister Amit Shah and the Delhi Police of ""lying"" that Jamia students were not beaten up inside the library.","The BJP accused the Congress of giving a 'political colour' to the incident and the Opposition party alleging that the government was 'misusing' the police force as its 'muscle men'.Hitting out at the BJP, Congress spokesperson Jaiveer Shergill said the ruling party had been caught 'red-handed'."
"The Delhi Police’s Crime Branch reportedly released a video, in which people can be seen allegedly with stones in their hands, in response to the video released by the Jamia Coordination Committee (JCC) showing cops entering the library in the varsity and attacking students.The Delhi Police Crime Branch's Special Investigation Team (SIT) on Sunday released CCTV footage, allegedly of the 15 December Jamia violence, in which people can be seen in a balcony with stones in their hands. The video has been accessed by India Today, and Firstpost cannot independently verify the authenticity of the video.Another video went viral on social media, showing persons being ushered into the library, allegedly with stones in some of their hands. As soon as 15-20 persons entered the library, a table was dragged and placed to block the entry point. The Crime Branch sources told India Today that the police were trying to locate these men after some vehicles were torched outside the university during Jamia violence.However, as per a JCC statement and reported by News18, students hid in the room to remain safe amid the violence. “Students also later switched off the lights and made SOS calls. This has already been stated in statement given by students to NHRC,” the JCC said. The university’s students reportedly hid in washrooms and locked doors to keep police personnel out.A CNN-News18 reporter on Monday also shared a video on Twitter quoting Jamia students refuting the allegation of the Delhi Police that one student in the video had a stone in his hand. Posting a clip of the video in which students in the library can be seen discussing the situation, the reporter Saahil Murli Menghani said students told him, ""If you look carefully, you will see that the students are not holding stones, but their wallets, which they also open at a point in the video.""Further, the students explain, ""In the library, students take their wallets out of their back pockets often and keep them on the table so that they are able to sit comfortably and study.""","The Delhi Police reportedly released a video from the day of the 15 December Jamia violence, in which people can be seen with stones in their hands, in response to the video released by the JCC Delhi Police questioned the veracity of the videos and said that some appear to be edited"
"In the five-minute long video, several students can be seen entering the old reading room, dragging a table to the door to block entryThe CCTV footage from the 15 December police crackdown on Jamia students showed how the paramilitary and police personnel, in riot gear, stormed into the libraryAt the same time, fearful students, including women, can be seen pleading with the police in folded hands as they tried to escape from the libraryAnother video in which Delhi police and paramilitary forces can be seen attacking unarmed students of Jamia Millia Islamia University inside its library reading room has emerged on Monday. In a five-minute long video, released by Maktoob media, several students can be seen entering the old reading room, dragging a table and whatever they can get their hands on to block entry for the cops.The video further shows the paramilitary and police personnel, in riot gear, storming into the library, removing the tables and then assaulting the students with lathis. Fearful students, including women, can be seen pleading with the police with folded hands as they attempt escaping from the library.One can also see students trying to desperately break out the reading room as the police continue to assault them. The angle of the CCTV (in the video) is such that one cannot see what is happening in the extreme left (see screengrab). But it seems like the entrance is not big enough for the students to escape. At the start of the video, one can see the police break down the door to enter the reading room. Another video of 15 Dec Jamia violence surfaces; CCTV footage shows trapped students as Delhi Police personnel break surveillance cameras","The CCTV footage from the 15 December police crackdown on Jamia students showed how the paramilitary and police personnel, in riot gear, stormed into the library."
"Mortaza first captained the ODI team in 2009 and permanently from 2014. He led Bangladesh to the 2017 Champions Trophy semi-finals and the 2015 Cricket World Cup quarter-finals.He has led Bangladesh in 87 ODIs and won 49. The chance to win a 50th on Friday was less important to him than achieving a series sweep of Zimbabwe.“We players don’t play for the milestone,"" Mortaza said. “As we take the field for the third game tomorrow, we’ll try to win another game. That’s the ultimate target.”The Bangladesh Cricket Board said before the series it will pick a new captain afterwards.“As captain, tomorrow’s match will be my last,” Mortaza said.“I want to thank the Bangladesh Cricket Board for keeping faith with me for such a long period. I will try to give my best as a player if the board gives me the opportunity. I have best wishes for the next captain. I will try to help him with the amount of experience I have gained.”","Mashrafe Mortaza is giving up the captaincy of Bangladesh’s one-day international team after the third and final match against Zimbabwe on Friday.He will continue to be available as an allrounder, he said on Thursday."
"Cricket's slow geographical expansion is turning out to be a blessing in disguise for the cash-rich Indian Premier League (IPL) which looks set to beat the dreaded novel coronavirus threat and go ahead as scheduled.At a time when the number of recorded deaths because of the deadly outbreak across the globe is touching 3500 with a plethora of international sporting events getting cancelled, the IPL seems to be in a parallel universe where ""all is well"".And there are multiple practical reasons why the T20 extravaganza will be held as per schedule.A major reason is the small number of countries that play the game and an even smaller fraction of overseas players, who will compete in the world's richest cricket league.Till Thursday, the reported number of positive COVID-19 cases in India stood at 29, including 16 Italian tourists included.However, none of the overseas recruits of eight IPL franchises have expressed any apprehensions about travelling to India.Just over 60 players from cricket nations such as Australia, England, New Zealand, South Africa and the Caribbean islands comprise the elite foreign brigade and the reported positive cases of coronavirus in all these countries are next to none.""The IOC is saying Olympics in Tokyo will be held as per schedule. IPL is a minuscule tournament in that regard. If the Olympics can be held, there's no reason why IPL can't be held,"" a BCCI official told PTI on conditions of anonymity.","While the number of recorded deaths because of the outbreak across the globe is touching 3500 with international sporting events getting cancelled, the IPL seems to be in a parallel universe where all is well."
"England Women made it to the semi-finals of the T20 World Cup. That was expected. What most pundits did not predict, however, was that they would finish second in the group. Even that should not have bothered them too much, for in a way it was an encore of the previous edition, when they, just like this time, had finished second and met India in the semi-final. They had won that day, so why fear?Unfortunately, they had not accounted for the weather. According to the playing conditions, in case of abandoned matches in the knockout stage, the topper of a group (India in this case) would go through to the final. In other words, there was little England could have done since their defeat against South Africa in the tournament opener.Had England won that match, they would have topped the group, avoided an elimination due to rain, and faced Australia in the second semi-final. If that was washed out, England would have gone through. As things turned out, since their first match, England’s survival in the tournament depended entirely on South Africa’s performances and weather.While Indian fans have reasons to celebrate the outcome – after all, this is going to be their first final in the history of the tournament – this is not the way they would have wanted to qualify.Of course, one cannot blame ICC for their faith in the Sydney Cricket Ground (SCG) ground staff and drainage system – they had ensured play during the Big Bash League (BBL) final against all odds – but even they cannot do anything if the rain does not stop at all.That ICC did not arrange for reserve days in case of washouts was known well in advance. However, as is often the case, the problem with the rules came into forefront only when it was actually implemented, not before the tournament.","ICC Women's T20 World Cup 2020: Time for organisers to do something about rain rules for knockout matchesThe first semi-final, between India and England, was abandoned without a ball bowled due to rain, but there are multiple ways to work around prevailing weather conditions."
"Tiger Shroff is a rebel for no reason. It is ironic then that he is the face (and/or kicks, punches, and washboard abdomen) of the Baaghi franchise. Rather than going against the tide, he is just swimming with the flow, and doing it with aggression and flexibility to camouflage his one-dimensional streak.In an era where every young star is constantly breaking barriers, avoiding stereotypes, and pushing the envelope in terms of acting, here is a Tiger Shroff whose filmography is merely a large blob of homogeneity. No one can take away the huge base of popularity he enjoys or the box office records set by his films, most recently Siddharth Anand's espionage thriller War from last year and Ahmed Khan's action drama Baaghi 2 from two years ago. But since he is stuck, comfortably so, in his image of an action hero, one cannot help but worry that he'll get jaded or burn out very soon, if not already.His defense is rather simplistic: ""In the industry which has so much talent and so much competition, it is very difficult to create an identity for oneself. So whatever little I am today it is because of the action genre. Yes, action does takes its toll but as long as I have my youth and physicality, I will continue with it."" The place where he comes from seems logical. But in the long run, his plan may be thwarted by the fact that this genre may soon become too convenient for him to venture out of, and try something new. Worse, his extremely loyal fan base may not accept him in any other avatar, especially if it is not something he is exceptionally good at.Going by his recent confession, Tiger is quite conscious and mindful of the expectation from his fan base. ""I got a lot of feedback from my fans saying that we are used to seeing you as a one man army and you take on machines, people single-handedly, but here I was a college guy who was getting bullied and beaten up and they couldn’t digest that. It didn’t go down too well with my audience,"" he said on the failure of his last solo release, Punit Malhotra's campus caper Student of the Year 2 in 2019.","Rather than going against the tide, he is just swimming with the flow, and doing it with aggression and flexibility to camouflage his one-dimensional streak.In an era where every young star is constantly breaking barriers, avoiding stereotypes, and pushing the envelope in terms of acting, here is a Tiger Shroff whose filmography is merely a large blob of homogeneity. "
"Life has come full circle for the versatile and immensely talented actor Sanjay Mishra known for strong, soulful performances. A National School of Drama (NSD) graduate who made his Bollywood debut with Shah Rukh Khan-starrer Oh Darling Yeh Hai India (1995), now has the superstar producing Mishra’s upcoming film Kaamyaab featuring latter as the main protagonist.Kaamyaab, that talks about the struggle of junior artistes, revolves around the life of character actor ‘Sudheer’ essayed by Mishra, who aspires to be remembered like other veteran character actors like Pran, Lalita Pawar and Shakti Kapoor. Kaamyaab - a tribute to supporting artistes, also has a talented bunch of iconic actors retelling their life to the audience.","Produced by SRK’s Red Chillies Entertainment and helmed by National Award winning director, Hardik Mehta, the film will make its way to the theatres on 6 March."
"Homi Adajania, director of the film, said he was overwhelmed with the gesture by all these actors.""The Angrezi Medium journey has been unlike anything I've experienced. It's been made with so much love and positivity and this video takes the spirit ahead. It's a glimpse of what love and positivity looks like. These are beautiful people who gave us time with little notice, selflessly pitched in and I love them for this,"" Homi said in a statement here.Katrina said everyone in the film industry should stand by each other.""Irrfan and Homi are two of my most favourite people, so when he called me there was no question of me not stepping in. I feel that when we can be there for someone, we should. That's how it should be in our industry,"" she said.""Irrfan sir has given all of us so much and we want to see him back soon and in the best health possible,"" Janhvi said.Alia said when she listened to 'Kudi Nu', the song made her want to fly and dance.""... That's how meaningful it is. It's a really cool song,"" Alia said.""When Homi sent me the song, it was on loop and it still is. This song is going to make everyone super happy,"" Anushka added.Producer Dinesh Vijan said such gestures make the world a better place.","Actors Alia Bhatt, Katrina Kaif, Anushka Sharma, among others have joined hands for a special track for Irrfan Khan-Radhika Madan starrer Angrezi Medium. The three top actors, along with Janhvi Kapoor, Kiara Advani, and Ananya Panday, rallied around Radhika in the music video 'Kudi Nu Nachan De', which celebrates women."
"After the death of his wife, the eccentric Dr John Dolittle, a veterinarian in Victorian England, shuts himself away from the rest of the world with only animals for company. However, when the young queen (played by Jessie Buckley falls ill, he has to jet off to a mythical island in search of a cure. ""We have no choice but to embark on this perilous journey,"" Dolittle says in the trailer. In his quest for a cure, he is joined by his animal buddies and a young apprentice (played by Harry Collett).Dolittle has an impressive voice-cast including Oscar-winners Octavia Spencer and Marion Cotillard, and other seasoned actors like Jim Broadbent, Emma Thompson, Michael Sheen, Ralph Fiennes and Antonio Banderas. The cast also includes wrestler John Cena, The Big Sick’s Kumail Nanjiani, Spider-Man: Homecoming's Tom Holland, Mr Robot's Rami Malek and singer Selena Gomez.Dolittle has been co-written and directed by Stephen Gaghan, known for Gold (2016) and Syriana (2005). John Whittington has collaborated with Gaghan to write the film. It was initially named The Voyage Of Doctor Dolittle and was in the works for a long time. In April 2019, Dolittle had to undergo reshoots due to concerns about the tone and flow, reports Collider.The film is executive produced by Downey Jr, Sarah Bradshaw and Zachary Roth. Doolittle will hit theatres on 17 January, 2020.","After playing a mighty superhero in Marvel films, Robert Downey Jr is now a physician, who can communicate with animals. Dolittle is a re-imagining of the classic tale by Hugh Lofting. From the looks of the trailer, the story is starkly different from Eddie Murphy's comedic Dr Dolittle franchise."
