"One woman accused Harvey Weinstein of forcing oral sex on her in his Manhattan apartment, even as she protested. She continued to see him, send friendly messages and seek work from him. A second woman said Weinstein, the one-time Hollywood titan, raped her in a midtown Manhattan hotel room. She maintained a sexual relationship with him for years, she said, to save her career. Two other women accusing him of sexual assault were waitresses who wanted to become actresses. One said she agreed to meet Weinstein about a film role after he had masturbated in front of her in a club. The other said she met him to talk about a script after he had reached up her skirt and touched her genitals during their first encounter. The prosecution rested its case against Weinstein on Thursday after graphic, first-person testimony from six women who said the producer had sexually assaulted them. But the district attorney's office has to overcome a significant hurdle: The two main witnesses against Weinstein maintained friendships with him after the alleged assaults, even having some consensual sexual encounters. Other accusers ignored his sexual misconduct and saw him again in the hope of getting work. That places a burden on prosecutors. They must explain to the jury of seven men and five women why some of the women continued to see him. ""It's confusing for the jury that they're being told they"" — Weinstein's accusers — ""were devastated by the crime and then they ask, 'When do I get to see you next?'"" said Matthew Galluzzo, a New York defense lawyer and a former Manhattan sex crimes prosecutor. Weinstein's lawyers are calling several witnesses to the stand to bolster his position that the relationships were consensual and in some cases transactional. Some of the women, the lawyers said, wanted to advance their own careers and use Weinstein to do so. ""You'll see they had a relationship,"" Damon Cheronis, a defense lawyer, said in his opening statement. ""You will see that sex was involved."" The trial is largely seen as a watershed moment for the #MeToo movement, a rebuke of decades of sexual harassment and abuse by men against women in the workplace, focusing attention on complex issues of consent and power dynamics. For weeks, Weinstein, who is 67 and recently had back surgery, has sat at the defense table, seemingly frail, slightly hunched and worn. He has used a walker to get around. It is an image that prosecutors have sought to counter. Weinstein, they told jurors, was a giant in Hollywood, known for Oscar-winning films including ""Shakespeare in Love"" and ""Pulp Fiction,"" who had used his influence and physicality to overpower and coerce women into sexual encounters. Two of the women who testified against Weinstein — Annabella Sciorra and Lauren Young — never contacted him again. Sciorra, an actress, said Weinstein barged into her own New York City apartment and raped her in the early 1990s. Young, a model, said Weinstein groped her breast in a hotel bathroom in Los Angeles while masturbating. At the heart of the criminal indictment are allegations made by two women: Miriam Haley, a former production assistant who said the producer forced oral sex on her inside of his home in 2006, and Jessica Mann, a former actress who accused him of raping her in a midtown Manhattan hotel in 2013. Weinstein has pleaded not guilty in state Supreme Court in Manhattan to five felony counts including criminal sexual assault, rape and predatory sexual assault. Testimony from Sciorra, known for her work in ""The Sopranos,"" is meant to support the predatory sexual assault charge, which requires that prosecutors show that the movie mogul committed a serious sex crime against at least two women. Weinstein faces up to life in prison if convicted on that charge. Young and two other women, Dawn Dunning and Tarale Wulff, recounted for the jury their encounters with Weinstein under a state law that allows testimony about ""prior bad acts"" to demonstrate a pattern of behavior. Prosecutors have said that Weinstein tricked young women into meeting with him under the impression he intended to help their careers. The Manhattan district attorney's case rests almost entirely on the women's testimony. None of them reported the attacks to the police at the time, and there is little physical or forensic evidence to support their claims, beyond photographs of the defendant that are being used to corroborate their descriptions of his body. It is a case, said Stephen Gillers, a New York University law professor, that turns on a single question: ""Do you believe the women?"" Defense lawyers used their cross-examinations to suggest that the witnesses had consented. On Thursday, the defense called Paul Feldsher, a former film producer, who recalled Sciorra telling him in the early 1990s on a walk in Manhattan that she had awkward sex with Weinstein but not that she had been raped. ""I remember Annabella saying to me that she'd done this crazy thing with Harvey,"" he said. Then he added, ""My understanding was that she fooled around with him."" For their part, prosecutors are banking that the women's accounts will support one another and establish a pattern of predatory behavior. A similar tactic proved effective in Bill Cosby's second sexual assault trial, in which he was convicted after five women testified. ""It may be easy to be skeptical of one or two reports,"" said Suzanne Goldberg, a Columbia University law professor, ""but as the reports pile up, it becomes hard for a thinking person to think that all of these reporters are lying."" From the start, prosecutors have tried to portray Weinstein as a calculating predator who groomed and targeted women he believed he could easily manipulate. His accusers, they say, fit that profile: Mann was a naive, aspiring actress who fled an abusive home on a dairy farm in Washington state, and Haley was a financially struggling production assistant from Sweden who had a tough childhood. Weinstein, who had walked red carpets around the world and rubbed elbows with Bill and Hillary Clinton, overawed his accusers, prosecutors said. Most of the women were not famous — with the exception of Sciorra — or financially secure, and they had few or no ties to their families. ""The power and balance he deviously exploited was not just physical, it was also professional and profoundly psychological,"" one of the prosecutors, Meghan Hast, said in her opening statement. ""You will see how that dynamic often causes victims to act in ways a layperson might not generally expect."" The women's accounts shared several similarities: Weinstein allegedly lured them to his home or a hotel room with the promise of an acting role or a job, then cornered them into a bedroom or bathroom, demanded that they undress — even as they protested — and coerced them into a sexual act, using physical and verbal intimidation. ""I had this dynamic with Harvey where I felt like I always had to obey and jump,"" Mann said Monday during cross-examination. Under earlier questioning, she told his lawyers, ""When he heard the word 'no' and you can't give him what he wanted — that is when this monster would come out."" Mann testified that she had maintained a yearslong relationship with Weinstein after he had forced oral sex on her during a meeting at a hotel in Beverly Hills, California. She said she had engaged in a number of consensual sexual encounters with him before and after the alleged rape in March 2013 at the Doubletree Hotel in midtown Manhattan until as late as 2016. ""I know the history of my relationship with him,"" she said this week. ""I know it is complicated and different, but it does not change the fact that he raped me."" Weinstein's lawyers have noted that Mann had sent dozens of friendly emails to him, which, according to the lawyers, suggest that the two were in a romantic relationship and that Mann's allegation that she was raped is false. In one email, she told him that he should meet her mother. In a 2014 email to a former boyfriend, Mann wrote that Weinstein had given her ""all of the validation she had ever needed."" Similarly, Haley, who legally changed her name from Mimi Haleyi, said she, too, had tried to maintain ""a professional connection"" with Weinstein. She said she continued to share scripts, pitch projects, seek work and accept tickets to movie premieres after the producer had forced oral sex on her. His lawyers suggested she was using Weinstein. A forensic psychiatrist, Barbara Ziv, testified for the prosecution that it is common for victims of a sexual assault to not report the crime to law enforcement and to remain in contact with their attacker. In some cases, Ziv said, victims worry that their assaulter might ruin their reputation or job. Sometimes the victim maintains a relationship with the perpetrator because they have a connection to the person. ""Those women do not always leave,"" Ziv said. ""In fact, they frequently do not leave, and they stay for a long period of time, and they may think about it, but they don't do it.""","The prosecution rested its case against Weinstein on Thursday after graphic, first-person testimony from six women who said the producer had sexually assaulted them. "
"American astronaut Christina Koch, who led the first all-female spacewalk in 2019, landed in Kazakhstan on Thursday after a record stay on the International Space Station, ending a 328-day mission expected to yield new insights into deep-space travel. Koch, a North Carolina-born engineer who joined Nasa's astronaut corps in 2013, set the record for the longest stay in space by a woman. Her mission will provide researchers valuable data on how weightlessness and space radiation affect the female body on long spaceflights. ""Women acclimate well to space, so I think this is a milestone that will be overtaken by women in the future and it's what we aspire to,"" said Lori Garver, Nasa's former deputy administrator. The Soyuz MS-13 capsule touched down on the snowy Kazakh Steppe at 4:12 am ET (0912 GMT) carrying Koch, 41, European astronaut Luca Parmitano of Italy and Russian cosmonaut Alexander Skvortsov. They will be flown by search and recovery teams to the Karaganda region to begin their journey home. Koch also achieved a gender milestone in a spacewalk with fellow Nasa astronaut Jessica Meir last October that marked the first time two women stepped out of the space station at the same time. They completed two more all-female spacewalks in January. Nasa's first attempt at an all-female spacewalk in March 2019 was called off due to a lack of a spacesuit in the right size, which ignited a gender-equity debate. Koch's 328 days in space eclipsed Peggy Whitson's record for an American woman on a single spaceflight at 289 days. President Donald Trump congratulated Koch on her record-setting mission. Scott Kelly holds the overall American record at 340 days, and Russia's Valeri Polyakov holds the global record of 437 days aboard the defunct Mir space station. Astronauts on the space station, whose 20th anniversary in low-Earth orbit comes later this year, have made 227 maintenance spacewalks, nearly two dozen of which included women astronauts, according to Nasa. Studying the impact of lengthy spaceflights could prove useful for Nasa's aim of building a permanent space station on the moon within the next decade. Kelly's 340 days demonstrated that long-term spaceflight causes thickening of the carotid artery and retina, changes in gene expression, and slight cognitive impairment for men.","American astronaut Christina Koch, who led the first all-female spacewalk in 2019, landed in Kazakhstan on Thursday after a record stay on the International Space Station, ending a 328-day mission expected to yield new insights into deep-space travel."
"Nasa astronaut Christina Koch is going to have her mission on the International Space Station (ISS) extended to 328 days, which would set a record for the longest single spaceflight by a woman, the US space agency said. Nasa and its ISS partners have set a new schedule and new crew assignments that will include the first flight of Nasa astronaut Jessica Meir and an extended stay for Nasa astronaut Andrew Morgan. Koch, who arrived at the space station on March 14, and now is scheduled to remain in orbit until February 2020, will eclipse the record of 288 days set by former Nasa astronaut Peggy Whitson in 2016-17. She will be part of three expeditions - 59, 60 and 61 - during her current first spaceflight, Nasa said in a statement. ""Christina's extended mission will provide additional data for Nasa's Human Research Program and continue to support future missions to the Moon and Mars,"" said Jennifer Fogarty, chief scientist of the Human Research Program at Nasa's Johnson Space Center in Houston, US. Her mission is planned to be just shy of the longest single spaceflight by a Nasa astronaut - 340 days, set by former Nasa astronaut Scott Kelly during his one-year mission in 2015-16. Koch and fellow Nasa astronaut Nick Hague, and Roscosmos cosmonaut Alexey Ovchinin will remain aboard the space station and begin Expedition 60. On July 20, Morgan, European Space Agency astronaut Luca Parmitano, and Roscosmos cosmonaut Alexander Skvortsov are scheduled to launch to the space station and join Expedition 60, returning the orbiting laboratory's crew complement to six. The extended missions of Koch and Morgan will help scientists gather additional data about the effects of long-duration human spaceflight beyond those of the normal six-month station expedition, Nasa said. Such research is essential to support future deep space exploration missions to the Moon and Mars, according to the US space agency. Nasa has gathered vast amounts of data on astronaut health and performance over the past 50 years and has focused recently on extended durations up to one year with the dedicated mission of Scott Kelly and extended mission of Peggy Whitson. These opportunities also have demonstrated that there is a significant degree of variability in human response to spaceflight and it is important to determine the acceptable degree of change for both men and women. ""Astronauts demonstrate amazing resilience and adaptability in response to long duration spaceflight exposure,"" said Fogarty. ""This will enable successful exploration missions with healthy, performance-ready astronauts. Nasa is looking to build on what we have learned with additional astronauts in space for more than 250 days,"" she said. ","Nasa astronaut Christina Koch is going to have her mission on the International Space Station (ISS) extended to 328 days, which would set a record for the longest single spaceflight by a woman, the US space agency said."
"After breaking a spaceflight record, a NASA astronaut is preparing to head home to Galveston. Christina Koch is back on Earth after being gone for nearly 11 months. The NASA astronaut and Galveston resident took a spaceflight of 328 days, which is more time than any other American female in history. Hours after she landed, she posted on social media, saying, ""This journey has been everyone's journey. Thank you to all involved in the success of our mission, and for giving me the opportunity to carry everyone's dreams into space. I'm filled with gratitude to be back on the planet!"" Koch told ABC News that she bets her husband missed her help with housework. On Thursday, ABC13 spoke with her husband, Robert Koch. He told us about her safe trip back to Earth, ""It's exciting, for sure."" Staying in space for that long isn't easy, especially when it comes to packing for that length of time. On Thursday, teachers got an up-close look at how she did it. This happened around the same time that the Space Exploration Educators Conference was underway at Space Center Houston. More than 600 teachers, from more than 10 countries were there, including Devon Sinclair, who traveled from Minnesota. ""I never in my life thought I'd be able to do this and find out about astronauts and trips to space,"" Sinclair said. There were local teachers too, including Kelly Swanson, who teaches science at Klein ISD. ""Just the tricks that I'm learning in there and seeing what an astronaut has to pack in, that's all going straight into my classroom,"" Swanson explained. For three days, teachers will listen to speakers, and take part in different hands-on experiments. It's something Space Center Houston has offered for 26 years. Now is more crucial than ever as NASA hopes current students help them get back to the moon, and beyond. ""It's exciting for me because I was a classroom teacher for 10 years and I knew the challenges I had,"" Space Center Houston's Vice President of Education, Daniel Newmyer said. ""So, this conference is about giving teachers that support they need. They may not have it in their systems."" A real-life lesson was thrown into the classroom Thursday. Koch's historic time in space not only provided lesson plan ideas for educators, but they also believe it'll inspire young girls to dream big. ""It's really inspirational for all of my students seeing a woman in space,"" Swanson said. ""It makes you feel like, this is something I can do. She looks like me. I could do this. This could be in my future as well."" ","The extended missions of Koch and Morgan will help scientists gather additional data about the effects of long-duration human spaceflight beyond those of the normal six-month station expedition, Nasa said."
"The impressive AMD Ryzen Threadripper 3990X, with its unprecedented 64-core count, is already setting world records not even 24 hours after its release. The latest and all-powerful release from AMD’s Threadripper 3rd Generation line is poised to become extreme onlookers’ new favorite toy after overclockers dropped world records around it on February 7, 2020. As Tom’s Hardware reports, pro overclockers TSAIK, Allen ""Splave"" Golibersuch and safedisk showed just what the Ryzen Threadripper 3990X is capable of. By pairing the new HEDT processor with carefully handpicked hardware, all three managed to overclock its 64 cores to a whopping 5.5GHz clock speed. AMD Ryzen Threadripper 3990X 64-core monster CPU is real. Ryzen Threadripper 48-core CPU could be another nail in the coffin for Intel. AMD confirms Ryzen 4000 CPUs will be out in 2020 Using liquid nitrogen (LN2), TSAIK overclocked all of the chip’s 64 cores to a 5,548.71MHz. He paired his Ryzen Threadripper 3990X with the MSI Creator TRX40 motherboard and DDR4 RAM clocked at 1,866 MHz with 13-13-13-31 CL timings. Splave, on the other hand, paired his Threadripper 3990X with the ASRock TRX40 Taichi motherboard and now holds tops the GPUPI for CPU - 1B, Geekbench 3 multi-core and Cinebench R20 benchmarks. He overclocked his chip to 5,475.43 MHz, 5,375 MHz and 5,305.88 MHz, respectively, using liquid nitrogen for at least the first two. Finally, safedisk currently holds the records for wPrime 1024m and Cinebench R15 benchmarks, clocking at 5,125 MHz and 5,225 MHz. These world records come days after benchmarks for the chip show it outperforming Intel’s Xeon Platinum 8280 processors, which are considerably more expensive at $10,009 (about £7,715, A$14,830). The AMD Ryzen Threadripper 3990X currently retails at $3,999 (about £3,080, A$5,925). It’s available for purchase now, if you just happen to have a few extra thousand dollars lying around.","By pairing the new HEDT processor with carefully handpicked hardware, all three managed to overclock its 64 cores to a whopping 5.5GHz clock speed."
"Today, we dropped our AMD Ryzen Threadripper 3990X review while overclockers dropped a number of world records around the chip. A professional overclocker known as TSAIK overclocked all 64 cores to a clock speed of 5,548.71 MHz using liquid nitrogen (LN2). Careful selection of the proper hardware is key to setting world records, of course. TSAIK paired his Threadripper 3990X with MSI's Creator TRX40 motherboard and a single stick of DDR4 RAM clocked at 1,866 MHz with 13-13-13-31 CL timings. In other news, pro overclockers Allen ""Splave"" Golibersuch and safedisk also managed to snatch a couple of world records of their own with the Threadripper 3990X. Splave currently holds the records for the GPUPI for CPU - 1B, Geekbench 3 multi-core and Cinebench R20 benchmarks with his chip overclocked to 5,475.43 MHz, 5,375 MHz and 5,305.88 MHz, respectively. Unlike TSAIK, Splave went with the ASRock TRX40 Taichi motherboard. Meanwhile, safedisk now has the highest scores for wPrime 1024m and Cinebench R15. His Threadripper 3990X was clocked at 5,125 MHz for the first benchmark and 5,225 MHz for the latter. Given the processor's more than generous core and thread counts, the Threadripper 3990X will likely become a new favorite toy for extreme overclockers.","A professional overclocker known as TSAIK overclocked all 64 cores to a clock speed of 5,548.71 MHz using liquid nitrogen (LN2). TSAIK paired his Threadripper 3990X with MSI's Creator TRX40 motherboard and a single stick of DDR4 RAM clocked at 1,866 MHz with 13-13-13-31 CL timings."
"The year is 2020 and today we are reviewing a new processor, a processor that reaches biblical proportions as, when it's fully utilized, it offers so much raw performance there is literally nothing comparable on the market, from any competitor. We review the all-new AMD Ryzen Threadripper 3990X, the behemoth of processors has actually made it to the home office and pro-consumer market at prices that will baffle Intel. This mega-core processor has 64 physical processor cores and 128 logical cores, all powered by ZEN2 architecture. This review is about to shock, awe and then some. Yes, it is rare that I feel a bit, well, nervous is not the word I am looking for, but feeling some sort of positive tension to test a product. In just three years time AMD climbed up from six, eight to twelve, sixteen, twenty-four, thirty-two... and now a processor with sixty-four processor cores. It is both shocking and baffling at the same time, the bounds forward that AMD has made are just astounding. Weirdly enough, it's becoming a little common already, I mean reviewing CPUs with 24 to even 32 processor cores. Today we again double that up and, albeit we are a consumer-oriented website and have a matching audience, AMD granted us the opportunity to review that 64-core beast. And truth be told, that is going to be a challenge, our software suite is mainly consumer-oriented; I mean finding software that can manage 16 or more cores is a challenge, let alone 64 cores and 128 threads. Obviously it is not a processor to game on (but you can), it is not a setup to 7-zip compress a few files (but you can). No, this is a processor that needs to sink its teeth into matching workloads, like a home virtual server platform, a transcode marvel, a product for video editing and streaming at the same time. The possibilities, while versatile, are of course limited. But all that doesn't matter, as the one message that AMD is relaying with the release of Threadripper 3990X is the simple fact that they can do stuff like this, no matter how small the install base is going to be. AMD unleashed their 3rd generation of Threadripper processors aka codename Castle Peak in 2019, we already reviewed the Ryzen Threadripper 3960X and 3970X, both stunning processors within their product segments and range. With the move towards the ZEN2 architecture accompanied by a chipset design, nobody was left disappointed. For many months it remained a bit of a question mark, would AMD also release new Threadripper processors, as the Ryzen 9 3950X already has 16 cores and 32 threads. Is there a point for AMD to invest in even more cores in what is a very narrow market? Well, it's AMD, of course, they would do just that for fun, kicks, and giggles to show CPU muscle. But certainly, there is also a business model at hand here, as there are SOHO companies out there that can work miracles out of 64 processor cores. The mega-core processors make relatively little sense for your avid PC gamer, these can be very compelling products to developers, content creators, and video editors. But there simply is no slowing down AMD as they are back at it with their core wars against Intel as they release the Threadripper Gen3. They started in 2019 with the 3960X & 3970X respectively holding 24 and 32 active ZEN2 processor cores. For Threadripper 3000 AMD performs gauntlet sorting of the dies, Threadripper Gen3 uses (binned) the best top 2% of dies. You know my lingo, eight is fine, sixteen is sweet and anything above that core count, spectacular. ","We review the all-new AMD Ryzen Threadripper 3990X, the behemoth of processors has actually made it to the home office and pro-consumer market at prices that will baffle Intel. This mega-core processor has 64 physical processor cores and 128 logical cores, all powered by ZEN2 architecture."
